{
  "$schema": "http://json-schema.org/draft-07/schema#",
  "title": "Chapter",
  "type": "object",
  "required": ["id", "name", "topics"],
  "properties": {
    "id": { "type": "string" },
    "name": { "type": "string" },
    "description": { "type": "string" },
    "overview": { "type": "string" },
    "order": { "type": "integer", "minimum": 1 },
    "topics": {
      "type": "array",
      "items": {
        "type": "object",
        "required": ["id", "name", "topicId"],
        "properties": {
          "id": { "type": "string" },
          "name": { "type": "string" },
          "description": { "type": "string" },
          "topicId": { "type": "string" }
        }
      }
    },
    "metadata": {
      "type": "object",
      "properties": {
        "estimatedMinutes": { "type": "number" },
        "difficulty": { "type": "string", "enum": ["beginner", "intermediate", "advanced"] }
      }
    }
  }
}
