{
  "id": "chapter-11",
  "name": "Computational Social Choice",
  "description": "Computational Social Choice",
  "overview": "This chapter covers the fundamental concepts of Computational Social Choice.",
  "topics": [
    {
      "id": "topic-01",
      "name": "Voting Algorithms",
      "topicId": "game-theory.voting-social-choice.chapter-11.topic-01"
    },
    {
      "id": "topic-02",
      "name": "Preference Learning",
      "topicId": "game-theory.voting-social-choice.chapter-11.topic-02"
    },
    {
      "id": "topic-03",
      "name": "Multi-Agent Voting",
      "topicId": "game-theory.voting-social-choice.chapter-11.topic-03"
    },
    {
      "id": "topic-04",
      "name": "AI Decision Making",
      "topicId": "game-theory.voting-social-choice.chapter-11.topic-04"
    },
    {
      "id": "topic-05",
      "name": "Computational Complexity",
      "topicId": "game-theory.voting-social-choice.chapter-11.topic-05"
    },
    {
      "id": "topic-06",
      "name": "Algorithmic Fairness",
      "topicId": "game-theory.voting-social-choice.chapter-11.topic-06"
    }
  ]
}