{
  "id": "chapter-12",
  "name": "Applications",
  "description": "Applications",
  "overview": "This chapter covers the fundamental concepts of Applications.",
  "topics": [
    {
      "id": "topic-01",
      "name": "Conservation Planning",
      "topicId": "biology.ecology.chapter-12.topic-01"
    },
    {
      "id": "topic-02",
      "name": "Wildlife Management",
      "topicId": "biology.ecology.chapter-12.topic-02"
    },
    {
      "id": "topic-03",
      "name": "Fisheries",
      "topicId": "biology.ecology.chapter-12.topic-03"
    },
    {
      "id": "topic-04",
      "name": "Forestry",
      "topicId": "biology.ecology.chapter-12.topic-04"
    },
    {
      "id": "topic-05",
      "name": "Environmental Assessment",
      "topicId": "biology.ecology.chapter-12.topic-05"
    },
    {
      "id": "topic-06",
      "name": "Ecotourism",
      "topicId": "biology.ecology.chapter-12.topic-06"
    },
    {
      "id": "topic-07",
      "name": "Sustainable Agriculture",
      "topicId": "biology.ecology.chapter-12.topic-07"
    }
  ]
}