{
  "id": "chapter-06",
  "name": "Cell Communication",
  "description": "Cell Communication",
  "overview": "This chapter covers the fundamental concepts of Cell Communication.",
  "topics": [
    {
      "id": "topic-01",
      "name": "Cell Signaling",
      "topicId": "biology.cell-biology.chapter-06.topic-01"
    },
    {
      "id": "topic-02",
      "name": "Receptors",
      "topicId": "biology.cell-biology.chapter-06.topic-02"
    },
    {
      "id": "topic-03",
      "name": "Signal Transduction",
      "topicId": "biology.cell-biology.chapter-06.topic-03"
    },
    {
      "id": "topic-04",
      "name": "Second Messengers",
      "topicId": "biology.cell-biology.chapter-06.topic-04"
    },
    {
      "id": "topic-05",
      "name": "Cell-to-Cell Communication",
      "topicId": "biology.cell-biology.chapter-06.topic-05"
    },
    {
      "id": "topic-06",
      "name": "Cellular Responses",
      "topicId": "biology.cell-biology.chapter-06.topic-06"
    }
  ]
}