{
  "id": "chapter-10",
  "name": "Matrices",
  "description": "Matrices",
  "overview": "This chapter covers the fundamental concepts of Matrices.",
  "topics": [
    {
      "id": "topic-01",
      "name": "Matrix Operations",
      "topicId": "mathematics.precalculus.chapter-10.topic-01"
    },
    {
      "id": "topic-02",
      "name": "Matrix Multiplication",
      "topicId": "mathematics.precalculus.chapter-10.topic-02"
    },
    {
      "id": "topic-03",
      "name": "Determinants",
      "topicId": "mathematics.precalculus.chapter-10.topic-03"
    },
    {
      "id": "topic-04",
      "name": "Inverse Matrices",
      "topicId": "mathematics.precalculus.chapter-10.topic-04"
    },
    {
      "id": "topic-05",
      "name": "Solving Systems with Matrices",
      "topicId": "mathematics.precalculus.chapter-10.topic-05"
    }
  ]
}