{
  "id": "chapter-02",
  "name": "Measuring Development",
  "description": "Measuring Development",
  "overview": "This chapter covers the fundamental concepts of Measuring Development.",
  "topics": [
    {
      "id": "topic-01",
      "name": "Gross Domestic Product (GDP)",
      "topicId": "economics.development-economics.chapter-02.topic-01"
    },
    {
      "id": "topic-02",
      "name": "GDP per Capita",
      "topicId": "economics.development-economics.chapter-02.topic-02"
    },
    {
      "id": "topic-03",
      "name": "Human Development Index (HDI)",
      "topicId": "economics.development-economics.chapter-02.topic-03"
    },
    {
      "id": "topic-04",
      "name": "Multidimensional Poverty Index (MPI)",
      "topicId": "economics.development-economics.chapter-02.topic-04"
    },
    {
      "id": "topic-05",
      "name": "Gini Coefficient",
      "topicId": "economics.development-economics.chapter-02.topic-05"
    },
    {
      "id": "topic-06",
      "name": "Sustainable Development Goals (SDGs)",
      "topicId": "economics.development-economics.chapter-02.topic-06"
    }
  ]
}