{
  "id": "chapter-11",
  "name": "Cell Signaling & Molecular Regulation",
  "description": "Cell Signaling & Molecular Regulation",
  "overview": "This chapter covers the fundamental concepts of Cell Signaling & Molecular Regulation.",
  "topics": [
    {
      "id": "topic-01",
      "name": "Cell Signaling",
      "topicId": "biology.biochemistry.chapter-11.topic-01"
    },
    {
      "id": "topic-02",
      "name": "Hormones",
      "topicId": "biology.biochemistry.chapter-11.topic-02"
    },
    {
      "id": "topic-03",
      "name": "Signal Transduction",
      "topicId": "biology.biochemistry.chapter-11.topic-03"
    },
    {
      "id": "topic-04",
      "name": "Second Messengers",
      "topicId": "biology.biochemistry.chapter-11.topic-04"
    },
    {
      "id": "topic-05",
      "name": "Protein Phosphorylation",
      "topicId": "biology.biochemistry.chapter-11.topic-05"
    },
    {
      "id": "topic-06",
      "name": "Gene Regulation",
      "topicId": "biology.biochemistry.chapter-11.topic-06"
    }
  ]
}