{
  "id": "chapter-06",
  "name": "Dark Matter",
  "description": "Dark Matter",
  "overview": "This chapter covers the fundamental concepts of Dark Matter.",
  "topics": [
    {
      "id": "topic-01",
      "name": "Evidence for Dark Matter",
      "topicId": "physics.cosmology.chapter-06.topic-01"
    },
    {
      "id": "topic-02",
      "name": "Galaxy Rotation Curves",
      "topicId": "physics.cosmology.chapter-06.topic-02"
    },
    {
      "id": "topic-03",
      "name": "Gravitational Lensing",
      "topicId": "physics.cosmology.chapter-06.topic-03"
    },
    {
      "id": "topic-04",
      "name": "Bullet Cluster",
      "topicId": "physics.cosmology.chapter-06.topic-04"
    },
    {
      "id": "topic-05",
      "name": "Dark Matter Candidates",
      "topicId": "physics.cosmology.chapter-06.topic-05"
    },
    {
      "id": "topic-06",
      "name": "Detection Experiments",
      "topicId": "physics.cosmology.chapter-06.topic-06"
    }
  ]
}