{
  "id": "chapter-02",
  "name": "Rotational Dynamics",
  "description": "Rotational Dynamics",
  "overview": "This chapter covers the fundamental concepts of Rotational Dynamics.",
  "topics": [
    {
      "id": "topic-01",
      "name": "Rotational Motion",
      "topicId": "physics.rotational-motion.chapter-02.topic-01"
    },
    {
      "id": "topic-02",
      "name": "Axis of Rotation",
      "topicId": "physics.rotational-motion.chapter-02.topic-02"
    },
    {
      "id": "topic-03",
      "name": "Translational vs Rotational Motion",
      "topicId": "physics.rotational-motion.chapter-02.topic-03"
    },
    {
      "id": "topic-04",
      "name": "Rotational Inertia",
      "topicId": "physics.rotational-motion.chapter-02.topic-04"
    },
    {
      "id": "topic-05",
      "name": "Rotational Equilibrium",
      "topicId": "physics.rotational-motion.chapter-02.topic-05"
    }
  ]
}